{
  "schema": "sibyl-label/1",
  "label_id": "019276b0-0000-7000-8000-000000000101",
  "tenant_id": "0192767f-0000-7000-8000-00000000a001",
  "agent_id": "0192767f-0000-7000-8000-00000000c010",
  "kind": "alert_verdict",
  "judges": {
    "kind": "health_snapshot",
    "id": "019276a2-7f00-7000-8000-000000000042",
    "feature_snapshot_ref": "fs_019276a2-7e00-7000-8000-000000000042"
  },
  "judged_as_of": "2026-10-09T09:15:50.000Z",
  "labelled_at": "2026-10-09T09:41:12.000Z",
  "labeller": {
    "kind": "operator",
    "ref": "0192767f-0000-7000-8000-00000000f001"
  },
  "value": {
    "verdict": "tp",
    "actual_failure_mode": "provider_outage",
    "lead_time_s": 610
  },
  "reason": "OpenAI status page confirmed elevated 429s from 09:25"
}
